{
  "schemaVersion": "1.0.0",
  "ruleSetVersion": "fengshui-v1",
  "ruleSetName": "24 Mountains, zheng zhen",
  "referenceSelection": "TRUE",
  "needleOffsetDeg": 0.0,
  "sectorCount": 24,
  "sectorWidthDeg": 15.0,
  "firstSectorCenterDeg": 0.0,
  "sectors": [
    { "index": 0,  "centerDeg": 0.0,   "name": "zi",   "glyph": "子", "group": "KAN",  "groupGlyph": "坎" },
    { "index": 1,  "centerDeg": 15.0,  "name": "gui",  "glyph": "癸", "group": "KAN",  "groupGlyph": "坎" },
    { "index": 2,  "centerDeg": 30.0,  "name": "chou", "glyph": "丑", "group": "GEN",  "groupGlyph": "艮" },
    { "index": 3,  "centerDeg": 45.0,  "name": "gen",  "glyph": "艮", "group": "GEN",  "groupGlyph": "艮" },
    { "index": 4,  "centerDeg": 60.0,  "name": "yin",  "glyph": "寅", "group": "GEN",  "groupGlyph": "艮" },
    { "index": 5,  "centerDeg": 75.0,  "name": "jia",  "glyph": "甲", "group": "ZHEN", "groupGlyph": "震" },
    { "index": 6,  "centerDeg": 90.0,  "name": "mao",  "glyph": "卯", "group": "ZHEN", "groupGlyph": "震" },
    { "index": 7,  "centerDeg": 105.0, "name": "yi",   "glyph": "乙", "group": "ZHEN", "groupGlyph": "震" },
    { "index": 8,  "centerDeg": 120.0, "name": "chen", "glyph": "辰", "group": "XUN",  "groupGlyph": "巽" },
    { "index": 9,  "centerDeg": 135.0, "name": "xun",  "glyph": "巽", "group": "XUN",  "groupGlyph": "巽" },
    { "index": 10, "centerDeg": 150.0, "name": "si",   "glyph": "巳", "group": "XUN",  "groupGlyph": "巽" },
    { "index": 11, "centerDeg": 165.0, "name": "bing", "glyph": "丙", "group": "LI",   "groupGlyph": "離" },
    { "index": 12, "centerDeg": 180.0, "name": "wu",   "glyph": "午", "group": "LI",   "groupGlyph": "離" },
    { "index": 13, "centerDeg": 195.0, "name": "ding", "glyph": "丁", "group": "LI",   "groupGlyph": "離" },
    { "index": 14, "centerDeg": 210.0, "name": "wei",  "glyph": "未", "group": "KUN",  "groupGlyph": "坤" },
    { "index": 15, "centerDeg": 225.0, "name": "kun",  "glyph": "坤", "group": "KUN",  "groupGlyph": "坤" },
    { "index": 16, "centerDeg": 240.0, "name": "shen", "glyph": "申", "group": "KUN",  "groupGlyph": "坤" },
    { "index": 17, "centerDeg": 255.0, "name": "geng", "glyph": "庚", "group": "DUI",  "groupGlyph": "兌" },
    { "index": 18, "centerDeg": 270.0, "name": "you",  "glyph": "酉", "group": "DUI",  "groupGlyph": "兌" },
    { "index": 19, "centerDeg": 285.0, "name": "xin",  "glyph": "辛", "group": "DUI",  "groupGlyph": "兌" },
    { "index": 20, "centerDeg": 300.0, "name": "xu",   "glyph": "戌", "group": "QIAN", "groupGlyph": "乾" },
    { "index": 21, "centerDeg": 315.0, "name": "qian", "glyph": "乾", "group": "QIAN", "groupGlyph": "乾" },
    { "index": 22, "centerDeg": 330.0, "name": "hai",  "glyph": "亥", "group": "QIAN", "groupGlyph": "乾" },
    { "index": 23, "centerDeg": 345.0, "name": "ren",  "glyph": "壬", "group": "KAN",  "groupGlyph": "坎" }
  ],
  "groups": [
    { "name": "KAN",  "glyph": "坎", "cardinal": "N",  "centerDeg": 0.0,   "widthDeg": 45.0 },
    { "name": "GEN",  "glyph": "艮", "cardinal": "NE", "centerDeg": 45.0,  "widthDeg": 45.0 },
    { "name": "ZHEN", "glyph": "震", "cardinal": "E",  "centerDeg": 90.0,  "widthDeg": 45.0 },
    { "name": "XUN",  "glyph": "巽", "cardinal": "SE", "centerDeg": 135.0, "widthDeg": 45.0 },
    { "name": "LI",   "glyph": "離", "cardinal": "S",  "centerDeg": 180.0, "widthDeg": 45.0 },
    { "name": "KUN",  "glyph": "坤", "cardinal": "SW", "centerDeg": 225.0, "widthDeg": 45.0 },
    { "name": "DUI",  "glyph": "兌", "cardinal": "W",  "centerDeg": 270.0, "widthDeg": 45.0 },
    { "name": "QIAN", "glyph": "乾", "cardinal": "NW", "centerDeg": 315.0, "widthDeg": 45.0 }
  ]
}
